user_id,screen_name,name,location,description,url,protected,followers_count,friends_count,listed_count,statuses_count,favourites_count,account_created_at,verified,profile_url,profile_expanded_url,account_lang,profile_banner_url,profile_background_url,profile_image_url,DateUpdate
29171735,BelowMK,Below- objetos que comunican-,NA,En Below nos aseguramos de las ideas se conviertan en exitosos regalos promocionales,https://t.co/GZiS1AV24E,FALSE,413,824,9,327,108,2009-04-06T09:30:46Z,FALSE,https://t.co/GZiS1AV24E,http://www.below.es,NA,https://pbs.twimg.com/profile_banners/29171735/1573904991,http://abs.twimg.com/images/themes/theme1/bg.png,http://pbs.twimg.com/profile_images/961576203718221829/1Xm4V8ss_normal.jpg,2021-09-20
2499773240,CSPPLASTICS,CSPPlastics,"Auburn Hills, Michigan","Vehicle light-weighting specialist. Patented composite materials and processes. Class A body panels, pickup boxes, EV battery cases and structural applications.",http://t.co/UyLHL9ah8h,FALSE,756,1569,17,1491,2945,2014-05-16T20:02:00Z,FALSE,http://t.co/UyLHL9ah8h,http://www.cspplastics.com,NA,https://pbs.twimg.com/profile_banners/2499773240/1503677489,http://abs.twimg.com/images/themes/theme1/bg.png,http://pbs.twimg.com/profile_images/468409910263173120/-08HaR7M_normal.jpeg,2021-09-20
2339930926,Plastic_Tech,BH2021,NA,NA,NA,FALSE,345,1052,2,1890,111,2014-02-12T20:01:16Z,FALSE,NA,NA,NA,https://pbs.twimg.com/profile_banners/2339930926/1622442604,http://abs.twimg.com/images/themes/theme1/bg.png,http://pbs.twimg.com/profile_images/1397031313392250883/fdpLH077_normal.jpg,2021-09-20
1879067778,SComposites,Silicone Composites Ltd,"Saltash, UK","Over 20 years experience in the Composite Industry.  
Closed mould silicone reusable bags with our state of the art ergonomic silicone spray machines.",http://t.co/S5myXKarBL,FALSE,290,511,4,69,17,2013-09-18T11:19:31Z,FALSE,http://t.co/S5myXKarBL,http://www.siliconecomposites.com,NA,https://pbs.twimg.com/profile_banners/1879067778/1571047515,http://abs.twimg.com/images/themes/theme15/bg.png,http://pbs.twimg.com/profile_images/1183685185226924032/pB4XCzm6_normal.jpg,2021-09-20
